{"schema":"contraste.case/v1","case_id":"C04","variant_id":"thin","model":[{"id":"G1-rating-paths","family":"generator","rung":"thin","title":{"en":"Rating paths with a known generator","es":"Trayectorias de calificación con un generador conocido"},"short_title":{"en":"RatingPaths","es":"RatingPaths"},"engine":"riskvalidation.generators.paths.RatingPaths","engine_version":"1.0.1","licence":"MIT","checkpoint_sha256":null,"calibration":null,"parameters":{"repetitions":{"value":0.0,"unit":"count"}}}],"outputs":{"kind":"generator","family":"thin","generator":{"q":[[-0.19535927198339695,0.19131144118096413,1.0698615678897734e-10,2.2784558885966185e-173,5.6213387271313865e-148,0.002862443796725478,0.001185386898721158,1.0858596856068698e-211],[0.0024835861229823885,-0.11747414167978792,0.1129876008254365,0.0017762887776392269,4.39427937186736e-05,0.00012978933238968527,1.923254729936118e-05,3.3701280322082165e-05],[7.794136471280505e-05,0.016943524116500252,-0.06373427545429886,0.04452809545192371,0.0009994066903065344,0.00039293351325854015,0.0005395834716194173,0.0002527908459776029],[7.608668033269466e-05,0.000606958502725635,0.035357351594140544,-0.0748533038673464,0.03452148762356906,0.0021438161391257177,0.0014367060420333356,0.0007108972854194164],[8.873997431963264e-05,0.00041430266668378963,5.9831927519212064e-15,0.05443349678684945,-0.1384559233320946,0.07716338456363361,0.0032424651251108465,0.003113534215491311],[1.1584476883590204e-109,0.0001597424079496234,0.0004699554670135481,5.4373630979879116e-06,0.06050813451931945,-0.1518114719097031,0.08167288338118883,0.00899531877113366],[7.378867490054391e-161,4.2440065685019185e-61,0.0005811595802266651,0.00016591155880590902,1.3341709124679838e-20,0.2517836343623077,-0.3464607051575694,0.0939299996562291],[0.0,0.0,0.0,0.0,0.0,0.0,0.0,-0.0]],"pd_1y":[6.566221704520959e-05,4.9105492561956295e-05,0.000288433147247171,0.0008167523299488059,0.003461591886708736,0.011730798585554945,0.08061763633032168],"pd_5y":[0.0012251300406847256,0.0006231820958568779,0.0021191163006211503,0.006138572046914182,0.02556655420220813,0.08214247499010208,0.2526569830445454],"obligors":[75,822,1814,1756,1054,1391,201],"source":"EM generator (riskvalidation.transitions.em) of S&P's pooled annual CEREP counts, computed by the case","one_year_matrix":[[0.8227399668948754,0.16371865017756917,0.009542360096875554,0.00029443607457457516,8.625477586450794e-05,0.0025478559119784536,0.0010048138512170966,6.566221704520959e-05],[0.0021293847711562467,0.890237656580023,0.1033101234539644,0.003928234308415452,0.000147298938128239,0.00014864092921026628,4.9555526540518125e-05,4.9105492561956295e-05],[8.872558081304408e-05,0.015507385168384331,0.9398744376582566,0.04162301743445611,0.0016196529917776848,0.0005102674041325691,0.0004880806149324757,0.000288433147247171],[7.00205771110494e-05,0.0008402910403745118,0.033052746531768894,0.9294699054825346,0.03115313537390271,0.0032670091356310424,0.0013301395287283525,0.0008167523299488059],[7.7493091204584e-05,0.0003977653723163688,0.000917926064010052,0.049002465974747826,0.8735741829499328,0.06741676358961542,0.005151811071464155,0.003461591886708736],[2.525262668564101e-06,0.000155422826556773,0.0004699272103222137,0.0014822862380997736,0.05256301452689782,0.8694820774526099,0.06411394789729008,0.011730798585554945],[2.2887242828635418e-07,2.1829603434154096e-05,0.0005303458933028573,0.00026371729042496154,0.006184370156288775,0.19740491751831635,0.7149769543354829,0.08061763633032168],[0.0,0.0,0.0,0.0,0.0,0.0,0.0,1.0]]},"design":{"years":1,"snapshots":[0.0,1.0],"reps":0,"seed_key":null},"ladder":{"name":{"en":"Obligors per grade","es":"Deudores por grado"},"unit":"count","values":[50,100,200,500,1000]},"rungs":[{"value":50,"level":0.95,"expected_defaults":[0.00328311085,0.00245527463,0.0144216574,0.0408376165,0.173079594,0.586539929,4.03088182],"coverage":{"wald":[0.00327783477,0.00245232304,0.0143202123,0.0400309159,0.159152716,0.445373434,0.913528575],"agresti_coull":[0.999994729,0.999997051,0.999899024,0.999203875,0.999280161,0.978991404,0.954506931],"jeffreys":[0.996722165,0.997547677,0.985679786,0.959968985,0.986852144,0.978991404,0.967615569]},"length":{"wald":[0.000192941416,0.000144314414,0.000845705034,0.0023826366,0.00985104057,0.0310886635,0.140356086],"agresti_coull":[0.0853130491,0.085288614,0.0856414647,0.0864176399,0.0902447806,0.101544951,0.164064192],"jeffreys":[0.0488856318,0.0488535777,0.0493161064,0.0503309996,0.0552882111,0.069580661,0.147220659]},"overlap_jeffreys":[1.0,1.0,1.0,0.999999977,0.999977619,0.875979835]},{"value":100,"level":0.95,"expected_defaults":[0.0065662217,0.00491054926,0.0288433147,0.081675233,0.346159189,1.17307986,8.06176363],"coverage":{"wald":[0.00654492528,0.00489863218,0.0284353326,0.0784579095,0.29299634,0.691512324,0.906776111],"agresti_coull":[0.999978749,0.999988102,0.999595871,0.996869007,0.994776559,0.969415325,0.959416842],"jeffreys":[0.993455075,0.995101368,0.971564641,0.921540452,0.952551232,0.969415325,0.935031518]},"length":{"wald":[0.000193466358,0.000144730218,0.000846193217,0.00237218039,0.00958536936,0.0286157055,0.104641947],"agresti_coull":[0.0445138794,0.044488212,0.0448586658,0.0456719861,0.0496411958,0.0607908386,0.112058942],"jeffreys":[0.0248761501,0.0248431737,0.0253182174,0.026354646,0.0313046858,0.0446616993,0.105323677]},"overlap_jeffreys":[1.0,1.0,1.0,0.999998569,0.999141554,0.616330587]},{"value":200,"level":0.95,"expected_defaults":[0.0131324434,0.00982109851,0.0576866294,0.163350466,0.692318377,2.34615972,16.1235273],"coverage":{"wald":[0.0130470135,0.00977326743,0.0560617207,0.150762389,0.50010613,0.90286581,0.923928395],"agresti_coull":[0.999914941,0.999952324,0.998406155,0.999365465,0.994572182,0.968359547,0.949947425],"jeffreys":[0.986952985,0.990226732,0.943937851,0.988073427,0.967058366,0.968359547,0.94564458]},"length":{"wald":[0.000193543144,0.000144833874,0.000842948178,0.00234037144,0.00907590041,0.0249049263,0.0748081508],"agresti_coull":[0.0227898129,0.0227634975,0.0231428937,0.0239722581,0.0279168083,0.0378484196,0.0774442232],"jeffreys":[0.0125983351,0.0125649314,0.013044535,0.0140792302,0.0188175693,0.0303144946,0.0749584768]},"overlap_jeffreys":[1.0,1.0,0.99999998,0.999932091,0.984126318,0.207783321]},{"value":500,"level":0.95,"expected_defaults":[0.0328311085,0.0245527463,0.144216574,0.408376165,1.73079594,5.86539929,40.3088182],"coverage":{"wald":[0.0322990141,0.024254353,0.134317316,0.335315787,0.821365186,0.925795486,0.948470249],"agresti_coull":[0.99947372,0.999704044,0.999553568,0.991652977,0.968646833,0.960867616,0.95199137],"jeffreys":[0.967700939,0.975745632,0.990563977,0.936253834,0.968646833,0.944610149,0.95199137]},"length":{"wald":[0.000193003386,0.00014456715,0.000830241222,0.00224416927,0.0079041467,0.0182429011,0.0475635172],"agresti_coull":[0.00929906572,0.00927238151,0.00965570049,0.0104801173,0.0140446983,0.0212503176,0.0482420923],"jeffreys":[0.00514223334,0.00510870959,0.00558534218,0.00658095907,0.0106812271,0.0189383918,0.047597491]},"overlap_jeffreys":[1.0,0.99999999,0.999996159,0.994309376,0.878283035,0.00181372262]},{"value":1000,"level":0.95,"expected_defaults":[0.065662217,0.0491054926,0.288433147,0.81675233,3.46159189,11.7307986,80.6176363],"coverage":{"wald":[0.0635541614,0.0479202294,0.250581297,0.558079539,0.857447812,0.938989134,0.947291106],"agresti_coull":[0.999955208,0.999981033,0.996781251,0.990298699,0.974940515,0.960947188,0.951947872],"jeffreys":[0.936445108,0.952079539,0.965621542,0.950209763,0.943748622,0.946359314,0.944935918]},"length":{"wald":[0.000191863491,0.000143937151,0.000809287121,0.00210512522,0.00659989869,0.0131955927,0.0336902702],"agresti_coull":[0.00472306216,0.00469631359,0.00507777248,0.00587019839,0.00882674563,0.0142122186,0.0339316195],"jeffreys":[0.00264134557,0.00260801052,0.00307452535,0.00400201182,0.00736705944,0.0133665791,0.0337018353]},"overlap_jeffreys":[1.0,0.999999976,0.999982556,0.971470851,0.698740504,5.96284905e-08]}],"simulations":[]},"tests":[],"impact":{"wald_coverage_aaa_50":{"value":0.00327783477,"unit":"probability","label":{"en":"Exact coverage of the 95% Wald interval for AAA with 50 obligors","es":"Cobertura exacta del intervalo de Wald al 95% para AAA con 50 deudores"}}},"findings":[{"id":"F-THIN","severity":"S2","status":"open","evidence":["design:rungs.coverage"],"title":{"en":"Exact coverage of the 95% intervals for AAA with 50 obligors: Wald 0.33% (it collapses to zero width at no default, the usual case), Agresti-Coull 100.00%, Jeffreys 99.67%","es":"Cobertura exacta de los intervalos al 95% para AAA con 50 deudores: Wald 0,33% (colapsa a ancho cero sin incumplimientos, el caso usual), Agresti-Coull 100,00%, Jeffreys 99,67%"}},{"id":"F-NOTCH","severity":"S3","status":"open","evidence":["design:rungs.overlap_jeffreys"],"title":{"en":"Even with 1,000 obligors per grade the Jeffreys intervals of AAA and AA overlap with probability 1.0000, of A and BBB 1.0000: their PDs cannot be told apart by the intervals","es":"Aun con 1.000 deudores por grado los intervalos de Jeffreys de AAA y AA se traslapan con probabilidad 1,0000, de A y BBB 1,0000: los intervalos no distinguen sus PD"}}],"provenance":{"truth_status":"synthetic-known-truth","inputs":[],"licence_classes":{},"generators":["RatingPaths"],"seed":42,"code_version":"1.00.000","riskvalidation_version":"1.0.1"},"lane":{"lane":"precompute","reasons":["not pure-python","wheels outside the live set: ['pypdf']","runtime exceeds the 1500ms budget"]}}